{
  "schema_version": "x07.lock@0.4.0",
  "toolchain": {
    "x07_version": "0.2.3",
    "x07c_version": "0.2.3",
    "lang_id": "x07-core@0.2.0",
    "compat": "0.5"
  },
  "registry": {
    "index_url": "sparse+https://registry.x07.io/index/"
  },
  "dependencies": [
    {
      "name": "ext-csv-rs",
      "version": "0.1.5",
      "path": ".x07/deps/ext-csv-rs/0.1.5",
      "package_manifest_sha256": "6893f3af3ee3b9ff84f055ae078e463da78305b928210891ec2c84e79004696d",
      "module_root": "modules",
      "modules_sha256": {
        "ext.csv": "09f75965c511bc084e99e7e0b82e9e19bde36e67b92b5e1eec22c77a2717d793",
        "ext.csv.data_model": "a4de66fec599d5ef92ca30c056ef4e235a9aff85b74caec7d027c6f3aca9b911",
        "ext.csv.tests": "2f9a4ea717e4d1eec3ae65c561877a574f0813f5c43badf501c5b4c283475582"
      },
      "yanked": false
    },
    {
      "name": "ext-data-model",
      "version": "0.1.10",
      "path": ".x07/deps/ext-data-model/0.1.10",
      "package_manifest_sha256": "953a76ee7036fba07c486ecd134e8cb65c4ac3b436d43040f886089413cebbe6",
      "module_root": "modules",
      "modules_sha256": {
        "ext.data_model": "def06160be3f2843479f579c41901b023537e0101ff87099af278b5d0fc31758",
        "ext.data_model.csv": "bd6f36f25bc0e01480859c59e2302f2865c960f100a95cadefed7fe59f4e0c99",
        "ext.data_model.csv.tests": "5df3b4a86cf222ca8962cb0ceab2c5fc861437713c36f262bca0fb891cc8614c",
        "ext.data_model.ini": "e6cc44509901f4b350da17deffcd653b985dc9ec277a72efe523f122bf06a4a4",
        "ext.data_model.ini.tests": "006b64f4404ba4da08eecaf9af201676fc49797a5a253b80d88236f78aa26e94",
        "ext.data_model.json": "13ac828bb939ecb593b2d300693d5cea1307cc92da92e632d61c10e1f8121006",
        "ext.data_model.json.tests": "1986759fde953f7760104f83ee4ac4c46e17457071c71ba0e3a43dc509d4d65d",
        "ext.data_model.tests": "77771892bb782ce1fdc7dc0bf45d0404fa35063f4429b2071229e42d00130b2f",
        "ext.data_model.toml": "4b624becaf1313a382b29ba80b6bde5292bdb002d3e4f9e55a3ddd23809fa9a0",
        "ext.data_model.toml.tests": "280744f2d36c5b3ec0a2908e1d3ad0469f07387c81f245426b1a9b81e92a1f36",
        "ext.data_model.xml": "6a93997653ad26b6922fa494a9b2bd15ab104626d0277f2fd267afd540974750",
        "ext.data_model.xml.tests": "8346ec79e12f8dde83721bab5727da4f1db94d89bed824caea29c8792794eb47",
        "ext.data_model.yaml": "95e49ea80ebbd4c9b4d25a8dee22c6eba6d604ceec936434f47deecbc46758ef",
        "ext.data_model.yaml.tests": "03fc345b1dcaf330f813b6d3c2b11f0bb1ea509f3f72c93b6d2e3146a1ed7f50"
      },
      "yanked": false
    },
    {
      "name": "ext-db-core",
      "version": "0.1.11",
      "path": ".x07/deps/ext-db-core/0.1.11",
      "package_manifest_sha256": "e87a0be1bcea96a9edfe55dfb9936d2264fa42d2e900774fdd64ef6115bf264a",
      "module_root": "modules",
      "modules_sha256": {
        "std.db": "49122422f3057827e81669955c3b03fa6c33912126d4085e71d7d6059e10c7b9",
        "std.db.dm": "5e324da1af86ac41a6c17f1da17a65256919a521c1776fb9aeaa0afc56e6e875",
        "std.db.params": "7cfd2e5038d23a08a502fd15fb7b5927a1f1499266c17e8f5b7f7fdac3146215",
        "std.db.pool": "d072995ccf88503bfb6dfd368e70a6bdd3725fd2ca8acc9c2ab356748a6714fb",
        "std.db.spec": "eda1a91783a0dc523d7887f3b87166bcfa76a1d4ac87ce76d45ef2f97b08853c"
      },
      "yanked": false
    },
    {
      "name": "ext-db-postgres",
      "version": "0.1.5",
      "path": ".x07/deps/ext-db-postgres/0.1.5",
      "package_manifest_sha256": "65047cd23af1b1e15408c0e481b3caa5dc7d5073fd429a3d704f9a6f1b3c5b90",
      "module_root": "modules",
      "modules_sha256": {
        "std.db.pg": "227989bcaf027d171b4b7f6c8d36b6a2e02d44fef46cbaf2ded94ec702cef8e8",
        "std.db.pg.pool": "83dbf13c07be21f9a53176481d6598970582518b62577c24865eb02dde433949",
        "std.db.pg.spec": "3fc082dc7b768658cf7820401f68dfcebf17167da73d145dc4346ad69499d4a2"
      },
      "yanked": false
    },
    {
      "name": "ext-ini-rs",
      "version": "0.1.4",
      "path": ".x07/deps/ext-ini-rs/0.1.4",
      "package_manifest_sha256": "fb98890e8826175d983a63bbea037cd005a5d555d2d339a295bed709a6f95f0d",
      "module_root": "modules",
      "modules_sha256": {
        "ext.ini": "9fc4d8075b2b23a3479d2e60b6a42142aac2e27013984d2a1e5b83fae2f80820",
        "ext.ini.data_model": "4748bc43a9eb46ed4a053fa4f07bf9ec7f9eb1ed814cf29bdb0d47e3e33edc03",
        "ext.ini.tests": "f311d5006c1db62968f7094a1bdf3dcd1c7ccf0af8aa820e2b67619ba85fd4a1"
      },
      "yanked": false
    },
    {
      "name": "ext-json-rs",
      "version": "0.1.6",
      "path": ".x07/deps/ext-json-rs/0.1.6",
      "package_manifest_sha256": "a716545e5618e6496c97fb4d1fdb5dff75b21e759d99ad5cd04f7bf128dfbcad",
      "module_root": "modules",
      "modules_sha256": {
        "ext.json.canon": "d12bffc708fc4afffd5c89cde28f714967782942291e677086ce505a28b87fb1",
        "ext.json.data_model": "65ab0ed5ada4d6668e2c394d836960b41447835b401ddd9d900a0e6b97013887",
        "ext.json.pointer": "658decbd56790023d28bd72ef5f6fe810ed69b0d1ab6275b0c6c54b1f414192a",
        "ext.json.tests": "7fea448131ac1000410096728326b629d3b9c29d6da04d07493feb3f20adce84"
      },
      "yanked": false
    },
    {
      "name": "ext-msg-amqp-c",
      "version": "0.1.3",
      "path": ".x07/deps/ext-msg-amqp-c/0.1.3",
      "package_manifest_sha256": "68d999e5cefe26627ebf61bc01fe3ddaddb7ab2c4a0c0d5134449d9cc61e48d5",
      "module_root": "modules",
      "modules_sha256": {
        "std.msg.amqp": "146fae8e5559c5c12aceea846db0c283c0da43ffc739bf69f58e8c846b7a5111",
        "std.msg.amqp.rr": "c2200e349190c417d3b1fae5f11c5f8da0daeb5658959bbc445ac3dcc40e4eb8",
        "std.msg.amqp.tests": "17af6750e26fc4105fe35dad322266bac16832900ec95348393347a3a753b818",
        "std.msg.amqp.topology": "60c9525cb52239f8bc11a8732ac8b16ea9dbd707142e77ba115b9d1ae9675bcd"
      },
      "yanked": false
    },
    {
      "name": "ext-msg-core",
      "version": "0.1.3",
      "path": ".x07/deps/ext-msg-core/0.1.3",
      "package_manifest_sha256": "85d0861b74444c267c2fd2f3c85a2dfa0b5c947e368b72fc425ea82e30ab67f8",
      "module_root": "modules",
      "modules_sha256": {
        "std.msg.driver": "23e543c73ad3fc69020e085b873a8c3f5e3bb8822c43d6d272077d56f9719f47",
        "std.msg.envelope": "18d05d97ae089b42a66332516d5c8fbc439f72ed54ac22be363c0cca168c6c37",
        "std.msg.rr": "e2c160317d0edeb4f739eed6f7da13058804c7e9e1efa5e54bc111dd2e5c320e",
        "std.msg.spec": "dd67455be1134e8e0849e2c0da908b92763cc18142d73b3a1ad110a0af0f4e2b",
        "std.msg.tests": "319dba8579f1055c5c2ba4e37563e345bf7272ad794f7ae22484bc5616459b97"
      },
      "yanked": false
    },
    {
      "name": "ext-toml-rs",
      "version": "0.1.5",
      "path": ".x07/deps/ext-toml-rs/0.1.5",
      "package_manifest_sha256": "0ddefacf2b4dd90955b954894a26ab4409e1a4a0fc71363a5d73aeaff060c3da",
      "module_root": "modules",
      "modules_sha256": {
        "ext.toml": "3bd80fbe0c44b57092432b628d3ce0068abe190d8c27395ebf9bf711bdeeea35",
        "ext.toml.data_model": "a156658af92d9a9e960d86e58de62c957b02440c7dbd6dca6e56fb28c6a1b642",
        "ext.toml.tests": "f3a1e8df9afd6da0927c097080344af08a3cf12ae5769686721bf462e122a046"
      },
      "yanked": false
    },
    {
      "name": "ext-unicode-rs",
      "version": "0.1.5",
      "path": ".x07/deps/ext-unicode-rs/0.1.5",
      "package_manifest_sha256": "8e316f53852c55576d9f65333538b1d90a1b5da380e9812ee97f046943c88779",
      "module_root": "modules",
      "modules_sha256": {
        "ext.unicode": "df35037b24fff1346db444d0281f002cc49f992799647d89d1ca80516714bbdb",
        "ext.unicode.casefold": "2a2be7ca592acef482c3e0015ad9748cd98b9a831bebce0791d11488a70d38c4",
        "ext.unicode.normalize": "4f86ecc58f838788004617c9978476a1821cb780ed8e640f965d1aa44b826fc5",
        "ext.unicode.segment": "341c8ace2b44f8fca0c5339bdbc8d102a6d06d36ef4a6a705601539a9fbf03c4",
        "ext.unicode.tests": "1d5209fc2aab58dca59930459fd054d8065eb7a7dd9e042c179149ba7252064f"
      },
      "yanked": false
    },
    {
      "name": "ext-xml-rs",
      "version": "0.1.4",
      "path": ".x07/deps/ext-xml-rs/0.1.4",
      "package_manifest_sha256": "9e784a1b16af2d809c00d50a3dfdd6746528b6633234c0ba130b8427ebbc178f",
      "module_root": "modules",
      "modules_sha256": {
        "ext.xml": "758a99622b077650c9ec0fdc7fe8d60261c27720bf944361f09dc2fd66d91b3d",
        "ext.xml.data_model": "c152bb642453e15060f7e6d602db0b1b65a3aa1ddb793037db2024f3d4cccb61",
        "ext.xml.tests": "3ff5feb0110c2fa362b452b849fbeb6ade61389badb734bff7ba81277adb391c"
      },
      "yanked": false
    },
    {
      "name": "ext-yaml-rs",
      "version": "0.1.4",
      "path": ".x07/deps/ext-yaml-rs/0.1.4",
      "package_manifest_sha256": "5a906c49ec1edd62a132a9577063148419c1583b2d38f3d79351da86727c7201",
      "module_root": "modules",
      "modules_sha256": {
        "ext.yaml": "065c86d25102c285092c7b9402ca773f38929f58c3acdebbfb4c6c567c1bf853",
        "ext.yaml.data_model": "2e1bf8111f4a41a45fd70f142fd17b5637b4a11d067c0ef2d073788b1f492bb3",
        "ext.yaml.tests": "3b25f2eb094d815c0669f35395d5ff9b1af9c6be5a7089cb50f66639784a0d1e"
      },
      "yanked": false
    }
  ]
}
