{
  "schema_version": "x07.lock@0.4.0",
  "toolchain": {
    "x07_version": "0.2.10",
    "x07c_version": "0.2.10",
    "lang_id": "x07-core@0.2.0",
    "compat": "0.5"
  },
  "registry": {
    "index_url": "sparse+https://registry.x07.io/index/"
  },
  "dependencies": [
    {
      "name": "ext-checksum-rs",
      "version": "0.1.2",
      "path": ".x07/deps/ext-checksum-rs/0.1.2",
      "package_manifest_sha256": "ede8c45dcf65f3e18bb6b3f24c1d51b8e1d53eabc2fcc54770ffc29a7bc75240",
      "module_root": "modules",
      "modules_sha256": {
        "ext.checksum.crc32c": "86dbd6095a6830ebf6e30c9499c6da7d1be199596f705d1a1e5d2e009a98555b",
        "ext.checksum.tests": "67d5175bba37e39d93020eddb3c99ee00285787a0eda6cf6b74734276b7ea169",
        "ext.checksum.xxhash64": "c759eeb4bc2521bf343440bcbeab1fa9f20d836ab123eb3c8173f11be649a8e5"
      },
      "yanked": false
    },
    {
      "name": "ext-u64-rs",
      "version": "0.1.4",
      "path": ".x07/deps/ext-u64-rs/0.1.4",
      "package_manifest_sha256": "aa92db2ba3222eaceb527e6eedb93eae771103b5b35b0ea1ebf46cb2d83dbb2b",
      "module_root": "modules",
      "modules_sha256": {
        "ext.u64": "c3ba79f0554026716bfa1feea479c1eaa5b31be0ad7a8d166416a6a35d8b9a43",
        "ext.u64.tests": "f4a739c17deb1dd369d9fb144111a87ce4f7c99f65f28265dfc1ce7f56eff86f"
      },
      "yanked": false
    }
  ]
}
