{
  "schema_version": "x07.lock@0.4.0",
  "toolchain": {
    "x07_version": "0.2.0",
    "x07c_version": "0.2.0",
    "lang_id": "x07-core@0.2.0",
    "compat": "0.5"
  },
  "registry": {
    "index_url": "sparse+https://registry.x07.io/index/"
  },
  "dependencies": [
    {
      "name": "ext-diff-rs",
      "version": "0.1.2",
      "path": ".x07/deps/ext-diff-rs/0.1.2",
      "package_manifest_sha256": "7b059c574408ca714e2def214e239474917cd8160506f5bab80395e305ffe9ea",
      "module_root": "modules",
      "modules_sha256": {
        "ext.diff.bytes": "8705e2a5d5e7fe319c762fd2c30b86919f888c6dc113e808aa2336ad27476557",
        "ext.diff.lines": "79235400ed467c076bea1f96323a772ed1d7a641e23a6cd40c597669c8019d49",
        "ext.diff.patch_v1": "4cff3f8b84048a8f0efc86aaa0d92e872b0f1bb9831594e8cbaee2ed1bfbc776",
        "ext.diff.tests": "bbf279d8b1856b97d1afe04024746b122cac6525ec03c01f8156ae44cf0943c6"
      },
      "yanked": false
    },
    {
      "name": "ext-error",
      "version": "0.1.4",
      "path": ".x07/deps/ext-error/0.1.4",
      "package_manifest_sha256": "c6b770b279357cb808057fddd8704516b74cef37f2c48fa84f06de063e1e6718",
      "module_root": "modules",
      "modules_sha256": {
        "ext.error.chain": "082d051b9eab7ffba7ab42f20ef6afdbe68389b9060d2fe876575d8fb9f1b76a",
        "ext.error.context": "3eac73db10c689e7a1e2c944301aadead445e164c3b24c381445fbedac9c5400",
        "ext.error.fmt": "ac94ff7ff9e4dae4b2a1739848addbb7e0aa87f25e3e73b80d5c6b822eb48c12",
        "ext.error.tests": "94903cfffa1f37dd22c1e5c2cc063d56ec6030b92a704e3bf247b7e1367cc906"
      },
      "yanked": false
    }
  ]
}
