{
  "schema_version": "x07.lock@0.4.0",
  "toolchain": {
    "x07_version": "0.2.2",
    "x07c_version": "0.2.2",
    "lang_id": "x07-core@0.2.0",
    "compat": "0.5"
  },
  "registry": {
    "index_url": "sparse+https://registry.x07.io/index/"
  },
  "dependencies": [
    {
      "name": "ext-unicode-rs",
      "version": "0.1.5",
      "path": ".x07/deps/ext-unicode-rs/0.1.5",
      "package_manifest_sha256": "8e316f53852c55576d9f65333538b1d90a1b5da380e9812ee97f046943c88779",
      "module_root": "modules",
      "modules_sha256": {
        "ext.unicode": "df35037b24fff1346db444d0281f002cc49f992799647d89d1ca80516714bbdb",
        "ext.unicode.casefold": "2a2be7ca592acef482c3e0015ad9748cd98b9a831bebce0791d11488a70d38c4",
        "ext.unicode.normalize": "4f86ecc58f838788004617c9978476a1821cb780ed8e640f965d1aa44b826fc5",
        "ext.unicode.segment": "341c8ace2b44f8fca0c5339bdbc8d102a6d06d36ef4a6a705601539a9fbf03c4",
        "ext.unicode.tests": "1d5209fc2aab58dca59930459fd054d8065eb7a7dd9e042c179149ba7252064f"
      },
      "yanked": false
    }
  ]
}
