{
  "schema_version": "x07.lock@0.4.0",
  "toolchain": {
    "x07_version": "0.2.10",
    "x07c_version": "0.2.10",
    "lang_id": "x07-core@0.2.0",
    "compat": "0.5"
  },
  "registry": {
    "index_url": "sparse+https://registry.x07.io/index/"
  },
  "dependencies": [
    {
      "name": "std-web-ui",
      "version": "0.2.6",
      "path": ".x07/deps/std-web-ui/0.2.6",
      "package_manifest_sha256": "0c64fbfddd77b10886c8c505d65cac2b3d4edd38ba3e58e0338c9159d7816ca6",
      "module_root": "modules",
      "modules_sha256": {
        "std.web_ui.effects.device.audio": "467e95b51f117634e77a06502ac7e662e6901bdc0041328204af80782f40a786",
        "std.web_ui.effects.device.blobs": "0c0a3ddf99ed8161f33281fe3d57d0c7a0662475eb532e6db340a679418ce169",
        "std.web_ui.effects.device.camera": "e11496d5b579b81528bd119868eda504df5975dc73797f9be0824dee26c30ff8",
        "std.web_ui.effects.device.clipboard": "9751a7d3591c29aff437c694844b4946cbda2a1cfca2ac748aa226a8622d7901",
        "std.web_ui.effects.device.common": "1f4c6a1723ee442d9b486e91005659883724b17ef14b24acde44a608b9adb9d7",
        "std.web_ui.effects.device.events": "bda78ad81b6e487d250d4d869c7cb4294d8a4209f1a965c88a51906a52d7d4e1",
        "std.web_ui.effects.device.files": "0dce08e2bd38cb7aafc6e0dc21282106240abdc202627d42e6d18d21ed2e8bef",
        "std.web_ui.effects.device.haptics": "0f1f3c649a04591f79100fba5ca1f66b58fd038ad3d1c9e425bab2f03a36d853",
        "std.web_ui.effects.device.location": "3414751441ee614f787c9a06f19598ae6bdfce06510d92f7dd4c3820b25ddd03",
        "std.web_ui.effects.device.notifications": "d0a12be94580f0995aaa1250552375ce895ea521e86c1d187c9c012064d53a4d",
        "std.web_ui.effects.device.permissions": "520b1c845f0f0d8b0ecfb67b096fe0efaad9d0512e4bbb2f0c8e75de568e7413",
        "std.web_ui.effects.device.share": "2ef7886a637c120e474d5638d6ca34a07483321f99dea19648c86c47ccc5173f",
        "std.web_ui.effects.http": "89a14c3951d08a93f6eeab7cc84c35b57fb9a2e96d260538d5e24e17ae44e480",
        "std.web_ui.effects.nav": "092676e77a6f1cba9f5250ae4b16903c1b94c7dea5fb9c993f7aabd9affeb085",
        "std.web_ui.effects.storage": "1dcfea4144bb67e74e60770966b4705127f28fbb185f19ba47f2e7d5e1b22a33",
        "std.web_ui.effects.timer": "08d5c5b9eb9af6d19eb68d4f1c9a952c4771cffb0ac38eaf5e91ce863b6e6283",
        "std.web_ui.patch": "194420e5ed2c322c34b597aab09f9938d9dd510dd79be22ccd8017d14da7607e",
        "std.web_ui.runtime": "7e44981b3697be46dc22d0214683a24c9ac4a0dfa91f6a9f1d0208dadaf3a3fb",
        "std.web_ui.schema": "786569f4876db2db0414a0fb8e3852affe2db200dd55f6ad77b604d5cdc32ff8",
        "std.web_ui.test": "23cc23f7e08e49413d10848f273bc48107dc315a2388155f6a37fce41e242cdd",
        "std.web_ui.tests": "89763668fa44d2a34ef11267ac659e3017eb3c71fda163e5ef8667666d22df53",
        "std.web_ui.trace": "c376b1550395cee67327c918ef7039921dcd78682825afe2a2d16eb8c8f617ec",
        "std.web_ui.vdom": "2be8650af27d75bac169a79c93350fbf94c2ec09447c943a4b8c572bc0dceaeb"
      },
      "yanked": false
    }
  ]
}
