{
  "schema_version": "x07.lock@0.4.0",
  "toolchain": {
    "x07_version": "0.2.1",
    "x07c_version": "0.2.1",
    "lang_id": "x07-core@0.2.0",
    "compat": "0.5"
  },
  "registry": {
    "index_url": "sparse+https://registry.x07.io/index/"
  },
  "dependencies": [
    {
      "name": "ext-bigint-rs",
      "version": "0.1.2",
      "path": ".x07/deps/ext-bigint-rs/0.1.2",
      "package_manifest_sha256": "aeebc18f11af3c4d465d7ad04227888b63ce6862e0fa2246a57096a043fb48da",
      "module_root": "modules",
      "modules_sha256": {
        "std.math.bigint": "bbfa024ebc697937d647602f4df12733ea4c4350276a042ab276677807a2c3e1",
        "std.math.bigint.codec_v1": "ba1c575d8d210311703637ac3ba29cfbb264c8a4ef4b61c2360e8744881a7f57",
        "std.math.bigint.fmt": "98675052af019d828e6e3cdb6aaab763e89acfb53f40d664feb6c1dbfc53f74d",
        "std.math.bigint.parse": "542ab8498c612f921fb2c98e4bf94d8c22be87f2f255799daa0516079bc30a74",
        "std.math.bigint.tests": "1c6d0ec34c448e7bb64a0e43a1d09dcbb1525c0637090f33d1933a24fbe8d1d7"
      },
      "yanked": false
    },
    {
      "name": "ext-error",
      "version": "0.1.4",
      "path": ".x07/deps/ext-error/0.1.4",
      "package_manifest_sha256": "c6b770b279357cb808057fddd8704516b74cef37f2c48fa84f06de063e1e6718",
      "module_root": "modules",
      "modules_sha256": {
        "ext.error.chain": "082d051b9eab7ffba7ab42f20ef6afdbe68389b9060d2fe876575d8fb9f1b76a",
        "ext.error.context": "3eac73db10c689e7a1e2c944301aadead445e164c3b24c381445fbedac9c5400",
        "ext.error.fmt": "ac94ff7ff9e4dae4b2a1739848addbb7e0aa87f25e3e73b80d5c6b822eb48c12",
        "ext.error.tests": "94903cfffa1f37dd22c1e5c2cc063d56ec6030b92a704e3bf247b7e1367cc906"
      },
      "yanked": false
    }
  ]
}
