{
  "schema_version": "x07.lock@0.4.0",
  "toolchain": {
    "x07_version": "0.2.10",
    "x07c_version": "0.2.10",
    "lang_id": "x07-core@0.2.0",
    "compat": "0.5"
  },
  "registry": {
    "index_url": "sparse+https://registry.x07.io/index/"
  },
  "dependencies": [
    {
      "name": "ext-cli",
      "version": "0.1.11",
      "path": ".x07/deps/ext-cli/0.1.11",
      "package_manifest_sha256": "a16252ab05f266dc3359071fc16ca86a6745244f99d18cc7ab18006d386066bb",
      "module_root": "modules",
      "modules_sha256": {
        "ext.cli": "ca7de75fda065788b5314b8266e94e46b1ef4db7c63d4b64aac15d46e4f10fc0",
        "ext.cli.complete": "e2019240ef981c4ec0653ba231e004b025f745b978a6f37d6c3aad7111716ec0",
        "ext.cli.help": "b9f65f30258d54335bad42bfbd4f6a55c80056780d236f5889f6e762efe6c360",
        "ext.cli.specrows": "5786b16971fef9d07065bcedea641c7015e49e3b10e9cb9382a649c739750f66",
        "ext.cli.tests": "c73c49e9fd349715ab7aa16c3e9fe977f77c1258e9499ebef3944a9c00d63b00"
      },
      "yanked": false
    },
    {
      "name": "ext-csv-rs",
      "version": "0.1.5",
      "path": ".x07/deps/ext-csv-rs/0.1.5",
      "package_manifest_sha256": "6893f3af3ee3b9ff84f055ae078e463da78305b928210891ec2c84e79004696d",
      "module_root": "modules",
      "modules_sha256": {
        "ext.csv": "09f75965c511bc084e99e7e0b82e9e19bde36e67b92b5e1eec22c77a2717d793",
        "ext.csv.data_model": "a4de66fec599d5ef92ca30c056ef4e235a9aff85b74caec7d027c6f3aca9b911",
        "ext.csv.tests": "2f9a4ea717e4d1eec3ae65c561877a574f0813f5c43badf501c5b4c283475582"
      },
      "yanked": false
    },
    {
      "name": "ext-data-model",
      "version": "0.1.8",
      "path": ".x07/deps/ext-data-model/0.1.8",
      "package_manifest_sha256": "c9498b87ac566e22a62aa67b25287419fc0898534283528e9ffcded4b1ba2f0a",
      "module_root": "modules",
      "modules_sha256": {
        "ext.data_model": "f725211ff55a6ad1db31f174dfbdcf55beccd7a24e44f8da929ecf7d5d0c0ccb",
        "ext.data_model.csv": "3535863cd84a4dc45d5068347ca7e6005aae64d596a638e8497810f3f9b562ad",
        "ext.data_model.csv.tests": "81d708e2f0df89050c2cbabf1ff739a88c0166b03ce95e2a0158f73d24159511",
        "ext.data_model.ini": "754a6ed3ecda50959762f9629e99537935dd793dc26e2a3394449f653ad3dff3",
        "ext.data_model.ini.tests": "f13271299d4131a702e33b4d058c98fc9d15f886f29ce93c2c64779f81a00a19",
        "ext.data_model.json": "22a4e24b30edfa5f809a6ec33e4676ad059dd50e2f8e37d944783649f4268b69",
        "ext.data_model.json.tests": "0af030b9b17d03c554364c518841410f9263470d25e1f75ae70c582ad1182f01",
        "ext.data_model.tests": "620b200c7570a4c6841cba26f5cda5f8451a7996f78bb73aec0ea3f6aafb825a",
        "ext.data_model.toml": "675037e7d4bee4a8f5ae791eb94e246760296e122977015a010686f6191d2118",
        "ext.data_model.toml.tests": "bb8bb19c44d0e5a2b296eef2d0e70b005d84317347d48958fbe28a7ee9d2e94b",
        "ext.data_model.xml": "a58d1ba50f669ab944dfe2621d26cd6cc85df5086470eb23d3d39b77478de140",
        "ext.data_model.xml.tests": "05017353879a1db1c4578cde7ccac8672b1e0c3f022a7471d79ca21e660934e5",
        "ext.data_model.yaml": "b6f260ed1c258711422ec36f0b7721b5b590e6e32472c4b23d837b3155865c7c",
        "ext.data_model.yaml.tests": "9fbb2323670b07f81daf0e339d73aff75cf4e340695ec5f1ae7410339f91609c"
      },
      "yanked": false
    },
    {
      "name": "ext-ini-rs",
      "version": "0.1.4",
      "path": ".x07/deps/ext-ini-rs/0.1.4",
      "package_manifest_sha256": "fb98890e8826175d983a63bbea037cd005a5d555d2d339a295bed709a6f95f0d",
      "module_root": "modules",
      "modules_sha256": {
        "ext.ini": "9fc4d8075b2b23a3479d2e60b6a42142aac2e27013984d2a1e5b83fae2f80820",
        "ext.ini.data_model": "4748bc43a9eb46ed4a053fa4f07bf9ec7f9eb1ed814cf29bdb0d47e3e33edc03",
        "ext.ini.tests": "f311d5006c1db62968f7094a1bdf3dcd1c7ccf0af8aa820e2b67619ba85fd4a1"
      },
      "yanked": false
    },
    {
      "name": "ext-json-rs",
      "version": "0.1.4",
      "path": ".x07/deps/ext-json-rs/0.1.4",
      "package_manifest_sha256": "d060ba6f911f0c5b8efc217007001679b848eee91413ec068faa88fdbb1064ed",
      "module_root": "modules",
      "modules_sha256": {
        "ext.json.canon": "0748c0cc8c3ad90ea0d0352ff9c444cc2b2116fce05782866d263c2d138dea7a",
        "ext.json.data_model": "d4762aee02eadf4b35fc425b496a6829c0c0f3f389eee667cae90023a4a2a7ff",
        "ext.json.pointer": "658decbd56790023d28bd72ef5f6fe810ed69b0d1ab6275b0c6c54b1f414192a",
        "ext.json.tests": "5ad25069a57e40b87d9ace8f4821d3f2e509df3e56348bd5f4ed914a1bfcdfcd"
      },
      "yanked": false
    },
    {
      "name": "ext-toml-rs",
      "version": "0.1.5",
      "path": ".x07/deps/ext-toml-rs/0.1.5",
      "package_manifest_sha256": "0ddefacf2b4dd90955b954894a26ab4409e1a4a0fc71363a5d73aeaff060c3da",
      "module_root": "modules",
      "modules_sha256": {
        "ext.toml": "3bd80fbe0c44b57092432b628d3ce0068abe190d8c27395ebf9bf711bdeeea35",
        "ext.toml.data_model": "a156658af92d9a9e960d86e58de62c957b02440c7dbd6dca6e56fb28c6a1b642",
        "ext.toml.tests": "f3a1e8df9afd6da0927c097080344af08a3cf12ae5769686721bf462e122a046"
      },
      "yanked": false
    },
    {
      "name": "ext-unicode-rs",
      "version": "0.1.5",
      "path": ".x07/deps/ext-unicode-rs/0.1.5",
      "package_manifest_sha256": "8e316f53852c55576d9f65333538b1d90a1b5da380e9812ee97f046943c88779",
      "module_root": "modules",
      "modules_sha256": {
        "ext.unicode": "df35037b24fff1346db444d0281f002cc49f992799647d89d1ca80516714bbdb",
        "ext.unicode.casefold": "2a2be7ca592acef482c3e0015ad9748cd98b9a831bebce0791d11488a70d38c4",
        "ext.unicode.normalize": "4f86ecc58f838788004617c9978476a1821cb780ed8e640f965d1aa44b826fc5",
        "ext.unicode.segment": "341c8ace2b44f8fca0c5339bdbc8d102a6d06d36ef4a6a705601539a9fbf03c4",
        "ext.unicode.tests": "1d5209fc2aab58dca59930459fd054d8065eb7a7dd9e042c179149ba7252064f"
      },
      "yanked": false
    },
    {
      "name": "ext-xml-rs",
      "version": "0.1.4",
      "path": ".x07/deps/ext-xml-rs/0.1.4",
      "package_manifest_sha256": "9e784a1b16af2d809c00d50a3dfdd6746528b6633234c0ba130b8427ebbc178f",
      "module_root": "modules",
      "modules_sha256": {
        "ext.xml": "758a99622b077650c9ec0fdc7fe8d60261c27720bf944361f09dc2fd66d91b3d",
        "ext.xml.data_model": "c152bb642453e15060f7e6d602db0b1b65a3aa1ddb793037db2024f3d4cccb61",
        "ext.xml.tests": "3ff5feb0110c2fa362b452b849fbeb6ade61389badb734bff7ba81277adb391c"
      },
      "yanked": false
    },
    {
      "name": "ext-yaml-rs",
      "version": "0.1.4",
      "path": ".x07/deps/ext-yaml-rs/0.1.4",
      "package_manifest_sha256": "5a906c49ec1edd62a132a9577063148419c1583b2d38f3d79351da86727c7201",
      "module_root": "modules",
      "modules_sha256": {
        "ext.yaml": "065c86d25102c285092c7b9402ca773f38929f58c3acdebbfb4c6c567c1bf853",
        "ext.yaml.data_model": "2e1bf8111f4a41a45fd70f142fd17b5637b4a11d067c0ef2d073788b1f492bb3",
        "ext.yaml.tests": "3b25f2eb094d815c0669f35395d5ff9b1af9c6be5a7089cb50f66639784a0d1e"
      },
      "yanked": false
    }
  ]
}
